{
  "name": "loan-application",
  "description": "A loan application workflow: submit → credit check → manual review (if needed) → approve/deny → disbursement → repayment tracking → completion or default",
  "places": [
    {"id": "submitted", "description": "Application submitted by customer", "initial": 1},
    {"id": "credit_check", "description": "Automated credit check in progress", "initial": 0},
    {"id": "auto_approved", "description": "Passed automatic approval criteria", "initial": 0},
    {"id": "manual_review", "description": "Requires manual underwriter review", "initial": 0},
    {"id": "approved", "description": "Loan has been approved", "initial": 0},
    {"id": "denied", "description": "Loan application denied", "initial": 0},
    {"id": "disbursed", "description": "Funds have been disbursed", "initial": 0},
    {"id": "repaying", "description": "Loan is being repaid", "initial": 0},
    {"id": "paid_off", "description": "Loan fully repaid", "initial": 0},
    {"id": "defaulted", "description": "Loan has defaulted", "initial": 0}
  ],
  "transitions": [
    {"id": "run_credit_check", "description": "Initiate automated credit check"},
    {"id": "auto_approve", "description": "Automatic approval based on credit score"},
    {"id": "flag_for_review", "description": "Flag application for manual review"},
    {"id": "underwriter_approve", "description": "Underwriter approves the application"},
    {"id": "underwriter_deny", "description": "Underwriter denies the application"},
    {"id": "auto_deny", "description": "Automatic denial based on credit score"},
    {"id": "finalize_approval", "description": "Finalize loan approval"},
    {"id": "disburse", "description": "Disburse loan funds to customer"},
    {"id": "start_repayment", "description": "Begin repayment period"},
    {"id": "make_payment", "description": "Customer makes a payment"},
    {"id": "complete", "description": "Final payment received, loan complete"},
    {"id": "mark_default", "description": "Mark loan as defaulted"}
  ],
  "arcs": [
    {"from": "submitted", "to": "run_credit_check"},
    {"from": "run_credit_check", "to": "credit_check"},
    {"from": "credit_check", "to": "auto_approve"},
    {"from": "auto_approve", "to": "auto_approved"},
    {"from": "credit_check", "to": "flag_for_review"},
    {"from": "flag_for_review", "to": "manual_review"},
    {"from": "credit_check", "to": "auto_deny"},
    {"from": "auto_deny", "to": "denied"},
    {"from": "manual_review", "to": "underwriter_approve"},
    {"from": "underwriter_approve", "to": "approved"},
    {"from": "manual_review", "to": "underwriter_deny"},
    {"from": "underwriter_deny", "to": "denied"},
    {"from": "auto_approved", "to": "finalize_approval"},
    {"from": "finalize_approval", "to": "approved"},
    {"from": "approved", "to": "disburse"},
    {"from": "disburse", "to": "disbursed"},
    {"from": "disbursed", "to": "start_repayment"},
    {"from": "start_repayment", "to": "repaying"},
    {"from": "repaying", "to": "make_payment"},
    {"from": "make_payment", "to": "repaying"},
    {"from": "repaying", "to": "complete"},
    {"from": "complete", "to": "paid_off"},
    {"from": "repaying", "to": "mark_default"},
    {"from": "mark_default", "to": "defaulted"}
  ]
}
