{
  "name": "staff",
  "description": "Baristas on duty. A pool of interchangeable people: a drink seizes one at the start of the brew and returns them at the end. Knows nothing about coffee — it only says how many hands there are. `initial` on `available` IS the headcount, so asking 'what if I put a third barista on?' is a change to one number.\n\nBoth pool arcs are `kinetic: false`, because a barista is a prerequisite, not an accelerant. Mass action multiplies every input into the firing rate, so with `busy` in the product two drinks in progress made each other finish twice as fast — per-drink brew time fell from 4.8 minutes at one barista to 2.2 at eight, which is a shop where hiring makes the espresso machine quicker. A non-kinetic arc still gates the firing and is still consumed by it: no free barista, no drink started. It just stops the count of people from setting the pace of the work.",
  "places": [
    {"id": "available", "kind": "token", "initial": 2, "exported": true},
    {"id": "busy", "kind": "token", "initial": 0, "exported": true}
  ],
  "transitions": [
    {"id": "acquire_espresso", "event": "staff.acquire_espresso"},
    {"id": "acquire_latte", "event": "staff.acquire_latte"},
    {"id": "acquire_cappuccino", "event": "staff.acquire_cappuccino"},
    {"id": "release_espresso", "event": "staff.release_espresso"},
    {"id": "release_latte", "event": "staff.release_latte"},
    {"id": "release_cappuccino", "event": "staff.release_cappuccino"}
  ],
  "arcs": [
    {"from": "available", "to": "acquire_espresso", "kinetic": false},
    {"from": "acquire_espresso", "to": "busy"},
    {"from": "available", "to": "acquire_latte", "kinetic": false},
    {"from": "acquire_latte", "to": "busy"},
    {"from": "available", "to": "acquire_cappuccino", "kinetic": false},
    {"from": "acquire_cappuccino", "to": "busy"},
    {"from": "busy", "to": "release_espresso", "kinetic": false},
    {"from": "release_espresso", "to": "available"},
    {"from": "busy", "to": "release_latte", "kinetic": false},
    {"from": "release_latte", "to": "available"},
    {"from": "busy", "to": "release_cappuccino", "kinetic": false},
    {"from": "release_cappuccino", "to": "available"}
  ],
  "constraints": [
    {
      "id": "pool_conservation",
      "expr": "tokens(\"available\") + tokens(\"busy\") == 2"
    }
  ]
}
