{
  "name": "job-application",
  "description": "A job application workflow: applied → phone screen AND background check (parallel) → interview → offer → hired/rejected",
  "places": [
    {"id": "applied", "description": "Application submitted", "initial": 1},
    {"id": "screening", "description": "Initial screening in progress", "initial": 0},
    {"id": "phone_screen_pending", "description": "Phone screen scheduled", "initial": 0},
    {"id": "phone_screen_complete", "description": "Phone screen completed", "initial": 0},
    {"id": "background_check_pending", "description": "Background check in progress", "initial": 0},
    {"id": "background_check_complete", "description": "Background check completed", "initial": 0},
    {"id": "ready_for_interview", "description": "Both screens passed, ready for interview", "initial": 0},
    {"id": "interviewing", "description": "Interview process ongoing", "initial": 0},
    {"id": "offer_extended", "description": "Job offer has been extended", "initial": 0},
    {"id": "hired", "description": "Candidate has been hired", "initial": 0},
    {"id": "rejected", "description": "Application rejected", "initial": 0}
  ],
  "transitions": [
    {"id": "start_screening", "description": "Begin candidate screening"},
    {"id": "schedule_phone_screen", "description": "Schedule phone screen"},
    {"id": "start_background_check", "description": "Initiate background check"},
    {"id": "complete_phone_screen", "description": "Complete phone screen"},
    {"id": "complete_background_check", "description": "Complete background check"},
    {"id": "advance_to_interview", "description": "Both checks passed, advance to interview"},
    {"id": "conduct_interview", "description": "Conduct interview"},
    {"id": "extend_offer", "description": "Extend job offer"},
    {"id": "accept_offer", "description": "Candidate accepts offer"},
    {"id": "reject_after_screen", "description": "Reject after screening"},
    {"id": "reject_after_interview", "description": "Reject after interview"},
    {"id": "decline_offer", "description": "Candidate declines offer"}
  ],
  "arcs": [
    {"from": "applied", "to": "start_screening"},
    {"from": "start_screening", "to": "screening"},
    {"from": "screening", "to": "schedule_phone_screen"},
    {"from": "schedule_phone_screen", "to": "phone_screen_pending"},
    {"from": "screening", "to": "start_background_check"},
    {"from": "start_background_check", "to": "background_check_pending"},
    {"from": "phone_screen_pending", "to": "complete_phone_screen"},
    {"from": "complete_phone_screen", "to": "phone_screen_complete"},
    {"from": "background_check_pending", "to": "complete_background_check"},
    {"from": "complete_background_check", "to": "background_check_complete"},
    {"from": "phone_screen_complete", "to": "advance_to_interview"},
    {"from": "background_check_complete", "to": "advance_to_interview"},
    {"from": "advance_to_interview", "to": "ready_for_interview"},
    {"from": "ready_for_interview", "to": "conduct_interview"},
    {"from": "conduct_interview", "to": "interviewing"},
    {"from": "interviewing", "to": "extend_offer"},
    {"from": "extend_offer", "to": "offer_extended"},
    {"from": "offer_extended", "to": "accept_offer"},
    {"from": "accept_offer", "to": "hired"},
    {"from": "screening", "to": "reject_after_screen"},
    {"from": "reject_after_screen", "to": "rejected"},
    {"from": "interviewing", "to": "reject_after_interview"},
    {"from": "reject_after_interview", "to": "rejected"},
    {"from": "offer_extended", "to": "decline_offer"},
    {"from": "decline_offer", "to": "rejected"}
  ]
}
